name,address,phone,rating,reviews,category,Medium,City,Full Street Address,Area / Locality
Swami Vivekananda Yoga Anusandhana Samsthana,"Giddenahalli Road Jigani, Bangalore",Show Number,4.3,1,Yoga-Centres,JustDial,Bangalore,Giddenahalli Road Jigani,Giddenahalli Road Jigani
Art Of Living Yoga And Meditation,"2nd B Cross Girinagar, Bangalore",Show Number,4.9,889,Yoga-Centres,JustDial,Bangalore,2nd B Cross Girinagar,2nd B Cross Girinagar
Sri Sri School Of Yoga,"21st Km Kanakapura Road, Bangalore",Show Number,5.0,811,Yoga-Centres,JustDial,Bangalore,21st Km Kanakapura Road,21st Km Kanakapura Road
Paripurna Yoga Kendra,"10th A Cross Yelahanka New Town, Bangalore",Show Number,5.0,720,Yoga-Centres,JustDial,Bangalore,10th A Cross Yelahanka New Town,10th A Cross Yelahanka New Town
Sai Power Yoga Institute,"Bannerghatta Road Akshayanagar, Bangalore",Show Number,5.0,587,Yoga-Centres,JustDial,Bangalore,Bannerghatta Road Akshayanagar,Bannerghatta Road Akshayanagar
Sri Siddhalingeshwara Yoga Vana Hills,"Amruthur Road Yediyur, Bangalore",Show Number,3.6,791,Yoga-Centres,JustDial,Bangalore,Amruthur Road Yediyur,Amruthur Road Yediyur
Sri Sai Powar Yoga Institute,"2nd Cross Road Devarachikkana Halli, Bangalore",Show Number,5.0,568,Yoga-Centres,JustDial,Bangalore,2nd Cross Road Devarachikkana Halli,2nd Cross Road Devarachikkana Halli
Isha Hatha Yoga,"An Gupta Layout, Bangalore",Show Number,5.0,553,Yoga-Centres,JustDial,Bangalore,An Gupta Layout,An Gupta Layout
God Gift Yoga and Nature Cure Centre,"Sultan Palya Main Road Rt Nagar, Bangalore",Show Number,4.7,556,Yoga-Centres,JustDial,Bangalore,Sultan Palya Main Road Rt Nagar,Sultan Palya Main Road Rt Nagar
Be And Make Swami Vivekananda Yoga For Total Health And Peace,"10th Main Malleshpalya, Bangalore",Show Number,4.8,372,Yoga-Centres,JustDial,Bangalore,10th Main Malleshpalya,10th Main Malleshpalya
Rashtrothana Yoga & Fitness Centre,"9th Cross Sadashivanagar, Bangalore",Show Number,4.8,370,Yoga-Centres,JustDial,Bangalore,9th Cross Sadashivanagar,9th Cross Sadashivanagar
Yoga Paanchajanya Yoga,"Ranka Colony Road Bilekahalli, Bangalore",Show Number,4.9,350,Yoga-Centres,JustDial,Bangalore,Ranka Colony Road Bilekahalli,Ranka Colony Road Bilekahalli
Akshar Yoga,"13th Cross Sadashivanagar, Bangalore",Show Number,4.1,414,Yoga-Centres,JustDial,Bangalore,13th Cross Sadashivanagar,13th Cross Sadashivanagar
Sri Ramana Maharshi Foundation,"Anekal Taluk Attibele, Bangalore",Show Number,4.5,371,Yoga-Centres,JustDial,Bangalore,Anekal Taluk Attibele,Anekal Taluk Attibele
Yoga Kulam,"CBI Road Rt Nagar, Bangalore",Show Number,4.9,335,Yoga-Centres,JustDial,Bangalore,CBI Road Rt Nagar,CBI Road Rt Nagar
Aarogyadwar Holistic Center,"Basavanagar Main Road Basava Nagar, Bangalore",Show Number,5.0,321,Yoga-Centres,JustDial,Bangalore,Basavanagar Main Road Basava Nagar,Basavanagar Main Road Basava Nagar
Bodhi Yoga Academy,"10th Main Road Jayanagar, Bangalore",Show Number,4.9,322,Yoga-Centres,JustDial,Bangalore,10th Main Road Jayanagar,10th Main Road Jayanagar
Bodhi School Of Yoga,"Hoysala Nagar-Indiranagar, Bangalore",Show Number,4.9,322,Yoga-Centres,JustDial,Bangalore,Hoysala Nagar-Indiranagar,Hoysala Nagar-Indiranagar
Vask Yoga Centre,"4th Main Road Hessargatta Main Road, Bangalore",Show Number,4.5,347,Yoga-Centres,JustDial,Bangalore,4th Main Road Hessargatta Main Road,4th Main Road Hessargatta Main Road
Sri Raksha Yoga Kendra,"Balaji Street Ramamurthy Nagar, Bangalore",Show Number,4.9,313,Yoga-Centres,JustDial,Bangalore,Balaji Street Ramamurthy Nagar,Balaji Street Ramamurthy Nagar
Vishwa Bhaavni Yoga Centre,"3rd Cross Road Circular Street, Bangalore",Show Number,4.8,302,Yoga-Centres,JustDial,Bangalore,3rd Cross Road Circular Street,3rd Cross Road Circular Street
Sankalp Yoga Shala,"13th Cross Road Jayanagar 6th Block, Bangalore",Show Number,4.9,295,Yoga-Centres,JustDial,Bangalore,13th Cross Road Jayanagar 6th Block,13th Cross Road Jayanagar 6th Block
Kushiyogalaya Yoga Classes,"Nandhini Layout. Nandini Layout, Bangalore",Show Number,5.0,284,Yoga-Centres,JustDial,Bangalore,Nandhini Layout. Nandini Layout,Nandhini Layout. Nandini Layout
Sanskriti Yogashala,"Bangarappanagar Main Road Bangarappanagar, Bangalore",Show Number,4.9,288,Yoga-Centres,JustDial,Bangalore,Bangarappanagar Main Road Bangarappanagar,Bangarappanagar Main Road Bangarappanagar
Bloom Prenatal Therapy Yoga,"KV Layout Jayanagar 4th T Block, Bangalore",,5.0,278,Yoga-Centres,JustDial,Bangalore,KV Layout Jayanagar 4th T Block,KV Layout Jayanagar 4th T Block
Shoban's Creative Yoga,"Sharada Nagar-Bikasipura, Bangalore",Show Number,4.9,282,Yoga-Centres,JustDial,Bangalore,Sharada Nagar-Bikasipura,Sharada Nagar-Bikasipura
Yoga Wellness Center,"2nd Cross Road Kasturi Nagar, Bangalore",Show Number,4.8,284,Yoga-Centres,JustDial,Bangalore,2nd Cross Road Kasturi Nagar,2nd Cross Road Kasturi Nagar
Rashtrotthana Yoga Centre,"E Block Brookefield, Bangalore",Show Number,4.8,276,Yoga-Centres,JustDial,Bangalore,E Block Brookefield,E Block Brookefield
A 1000 Yoga,"1st Cross Koramangala, Bangalore",Show Number,4.0,326,Yoga-Centres,JustDial,Bangalore,1st Cross Koramangala,1st Cross Koramangala
Rv Yoga Kendra,"Ramamurthy Nagara Main Road Ramamurthy Nagar, Bangalore",Show Number,4.7,273,Yoga-Centres,JustDial,Bangalore,Ramamurthy Nagara Main Road Ramamurthy Nagar,Ramamurthy Nagara Main Road Ramamurthy Nagar
Trimuk Yoga,"Jp Nagar 5th Phase, Bangalore",Show Number,4.9,250,Yoga-Centres,JustDial,Bangalore,Jp Nagar 5th Phase,Jp Nagar 5th Phase
Chaitanya Wellness Yoga Academy,"GR Arcade Kasavanahalli, Bangalore",Show Number,4.8,248,Yoga-Centres,JustDial,Bangalore,GR Arcade Kasavanahalli,GR Arcade Kasavanahalli
Sri Krishna Wellness Yoga And Cultural Centre,"6th Main Malleswaram, Bangalore",Show Number,4.7,250,Yoga-Centres,JustDial,Bangalore,6th Main Malleswaram,6th Main Malleswaram
The Yoga Room By Vidhya Vakil,"National Games Village Complex KHB Games Village, Bangalore",Show Number,5.0,234,Yoga-Centres,JustDial,Bangalore,National Games Village Complex KHB Games Village,National Games Village Complex KHB Games Village
Sunraya Yoga & Wellness Center,"NO 9 8TH E MAIN Vidyaranyapura, Bangalore",Show Number,4.9,236,Yoga-Centres,JustDial,Bangalore,NO 9 8TH E MAIN Vidyaranyapura,NO 9 8TH E MAIN Vidyaranyapura
Stepperz Aerobics Dance N Yoga Studio,"13th Cross Sadashivanagar, Bangalore",Show Number,4.0,270,Yoga-Centres,JustDial,Bangalore,13th Cross Sadashivanagar,13th Cross Sadashivanagar
Metta Yoga & Pilates Studio,"Ivri Road Yelahanka, Bangalore",Show Number,5.0,208,Yoga-Centres,JustDial,Bangalore,Ivri Road Yelahanka,Ivri Road Yelahanka
Ashish Yoga Fitness Varthur,"Devasthanagalu, Bangalore",Show Number,5.0,202,Yoga-Centres,JustDial,Bangalore,Devasthanagalu,Devasthanagalu
Aayana Yoga Academy,"37th Cross Jayanagar 4th T Block, Bangalore",Show Number,4.9,203,Yoga-Centres,JustDial,Bangalore,37th Cross Jayanagar 4th T Block,37th Cross Jayanagar 4th T Block
Sri Gururaya School Of Yoga,"Gnana Bharathi Main Road Nagarbhavi, Bangalore",Show Number,4.9,202,Yoga-Centres,JustDial,Bangalore,Gnana Bharathi Main Road Nagarbhavi,Gnana Bharathi Main Road Nagarbhavi
Chaitanya Wellness Yoga Studio,"7th Cross C V Raman Nagar, Bangalore",Show Number,4.6,209,Yoga-Centres,JustDial,Bangalore,7th Cross C V Raman Nagar,7th Cross C V Raman Nagar
Deepam Yoga Classes,"Nagarabhavi Nagarbhavi, Bangalore",Show Number,4.9,188,Yoga-Centres,JustDial,Bangalore,Nagarabhavi Nagarbhavi,Nagarabhavi Nagarbhavi
The Rising Soul Yoga,"Shirdi Sai Nagar-Munekollal, Bangalore",Show Number,4.9,186,Yoga-Centres,JustDial,Bangalore,Shirdi Sai Nagar-Munekollal,Shirdi Sai Nagar-Munekollal
Chikitsa Yoga Treatment Center,"Uttarahalli Main Road Uttarahalli, Bangalore",Show Number,4.9,181,Yoga-Centres,JustDial,Bangalore,Uttarahalli Main Road Uttarahalli,Uttarahalli Main Road Uttarahalli
National Academy For Naturopathy And Yoga,"3rd Cross Vijaya Bank Layout, Bangalore",Show Number,4.8,183,Yoga-Centres,JustDial,Bangalore,3rd Cross Vijaya Bank Layout,3rd Cross Vijaya Bank Layout
Aarya Yoga,"10th Cross Road Hebbal, Bangalore",Show Number,4.9,178,Yoga-Centres,JustDial,Bangalore,10th Cross Road Hebbal,10th Cross Road Hebbal
Prana Yoga Studio And Acupuncture Clinic,"K Narayanapura Road Kothanur, Bangalore",Show Number,4.7,180,Yoga-Centres,JustDial,Bangalore,K Narayanapura Road Kothanur,K Narayanapura Road Kothanur
Shree Yoga Academy,"Double Road Doddakallasandra, Bangalore",Show Number,5.0,167,Yoga-Centres,JustDial,Bangalore,Double Road Doddakallasandra,Double Road Doddakallasandra
Atma Darshan Yogashram,"Dayanandasagar College Road Kumaraswamy Layout, Bangalore",Show Number,4.6,176,Yoga-Centres,JustDial,Bangalore,Dayanandasagar College Road Kumaraswamy Layout,Dayanandasagar College Road Kumaraswamy Layout
Shivananda Yoga Centtre,"9th B Cross HBR Layout 4th Block, Bangalore",Show Number,4.8,164,Yoga-Centres,JustDial,Bangalore,9th B Cross HBR Layout 4th Block,9th B Cross HBR Layout 4th Block
Laksh Yoga,"Sarvabhouma Nagar Bilekahalli, Bangalore",Show Number,5.0,156,Yoga-Centres,JustDial,Bangalore,Sarvabhouma Nagar Bilekahalli,Sarvabhouma Nagar Bilekahalli
Sangamithra Yoga,"Ramamurthy Nagar, Bangalore",Show Number,5.0,151,Yoga-Centres,JustDial,Bangalore,Ramamurthy Nagar,Ramamurthy Nagar
Yogashree,"Ramakrishna Garden Girinagar, Bangalore",Show Number,4.9,153,Yoga-Centres,JustDial,Bangalore,Ramakrishna Garden Girinagar,Ramakrishna Garden Girinagar
Vismaya Yoga Centre,"Begur Main Road Bommanahalli, Bangalore",Show Number,4.9,152,Yoga-Centres,JustDial,Bangalore,Begur Main Road Bommanahalli,Begur Main Road Bommanahalli
Dharshmi Yoga Academy,"Outer Ring Road Mahadevapura, Bangalore",Show Number,4.8,155,Yoga-Centres,JustDial,Bangalore,Outer Ring Road Mahadevapura,Outer Ring Road Mahadevapura
San Yoga Studio,"Tumkur Road Yeshwanthpur, Bangalore",Show Number,5.0,147,Yoga-Centres,JustDial,Bangalore,Tumkur Road Yeshwanthpur,Tumkur Road Yeshwanthpur
Mamdev Yoga Hub,"Srinivasnagar Main Road Banashankari, Bangalore",Show Number,4.9,149,Yoga-Centres,JustDial,Bangalore,Srinivasnagar Main Road Banashankari,Srinivasnagar Main Road Banashankari
Hriti Yoga By Ruchi,"Vigneshwar Nagar, Bangalore",Show Number,5.0,139,Yoga-Centres,JustDial,Bangalore,Vigneshwar Nagar,Vigneshwar Nagar
Isha Yoga Center,"1st Block East Jayanagar 1st Block, Bangalore",Show Number,4.6,151,Yoga-Centres,JustDial,Bangalore,1st Block East Jayanagar 1st Block,1st Block East Jayanagar 1st Block
Yogakshema Yoga Center,"10th Main Ngef Layout Nagarbhavi, Bangalore",Show Number,4.9,140,Yoga-Centres,JustDial,Bangalore,10th Main Ngef Layout Nagarbhavi,10th Main Ngef Layout Nagarbhavi
Prashanth Yoga Mandir,"2nd Main Road Vijayanagar, Bangalore",,4.9,139,Yoga-Centres,JustDial,Bangalore,2nd Main Road Vijayanagar,2nd Main Road Vijayanagar
Aayush Yoga Mandir And Fitness,"Srinivas Complex Doddaballapur, Bangalore",Show Number,4.9,138,Yoga-Centres,JustDial,Bangalore,Srinivas Complex Doddaballapur,Srinivas Complex Doddaballapur
Fitness Yoga,"Wheeler Road Frazer Town, Bangalore",Show Number,4.8,133,Yoga-Centres,JustDial,Bangalore,Wheeler Road Frazer Town,Wheeler Road Frazer Town
Nourish Homeyoga,"Krishnarajapuram, Bangalore",,4.9,130,Yoga-Centres,JustDial,Bangalore,Krishnarajapuram,Krishnarajapuram
Sparsh Yoga Centre,"24th Main Jp Nagar 6th Phase, Bangalore",Show Number,4.8,130,Yoga-Centres,JustDial,Bangalore,24th Main Jp Nagar 6th Phase,24th Main Jp Nagar 6th Phase
Vedic Yoga Shala,"1st Main Koramangala, Bangalore",Show Number,5.0,122,Yoga-Centres,JustDial,Bangalore,1st Main Koramangala,1st Main Koramangala
Guhyamworld Health And Wellness Store,"5th A Main Road Malleshpalya, Bangalore",Show Number,5.0,119,Yoga-Centres,JustDial,Bangalore,5th A Main Road Malleshpalya,5th A Main Road Malleshpalya
Do Yoga,"4th Main Road Hsr Layout, Bangalore",Show Number,4.6,127,Yoga-Centres,JustDial,Bangalore,4th Main Road Hsr Layout,4th Main Road Hsr Layout
Shivanjali Yoga Kendra,"1st Cross Road Sahakara Nagar, Bangalore",Show Number,4.9,119,Yoga-Centres,JustDial,Bangalore,1st Cross Road Sahakara Nagar,1st Cross Road Sahakara Nagar
Srimoyi Yoga,"Sarjapur Outer Ring Road Bellandur, Bangalore",Show Number,4.4,130,Yoga-Centres,JustDial,Bangalore,Sarjapur Outer Ring Road Bellandur,Sarjapur Outer Ring Road Bellandur
Zorba - Yoga Studio,"Thambu Chetty Palya Main Road Ragavendra Circle, Bangalore",Show Number,4.7,116,Yoga-Centres,JustDial,Bangalore,Thambu Chetty Palya Main Road Ragavendra Circle,Thambu Chetty Palya Main Road Ragavendra Circle
Kaushalam Yoga Kendra,"13th Cross Road Jp Nagar, Bangalore",Show Number,4.8,113,Yoga-Centres,JustDial,Bangalore,13th Cross Road Jp Nagar,13th Cross Road Jp Nagar
Gnanisprit Yoga,"17th Main Road Byataranyanapura, Bangalore",Show Number,5.0,107,Yoga-Centres,JustDial,Bangalore,17th Main Road Byataranyanapura,17th Main Road Byataranyanapura
Yoga Sangha,"19th Main Road Hsr Layout Sector 4, Bangalore",Show Number,4.8,111,Yoga-Centres,JustDial,Bangalore,19th Main Road Hsr Layout Sector 4,19th Main Road Hsr Layout Sector 4
Akshar Power Yoga Academy,"Block C Sahakara Nagar, Bangalore",Show Number,4.4,119,Yoga-Centres,JustDial,Bangalore,Block C Sahakara Nagar,Block C Sahakara Nagar
Shree Yoga,"Aecs Layout C Block Aecs Layout Bengaluru Brookefield, Bangalore",Show Number,4.9,105,Yoga-Centres,JustDial,Bangalore,Aecs Layout C Block Aecs Layout Bengaluru Brookefield,Aecs Layout C Block Aecs Layout Bengaluru Brookefield
Neolife Yoga Studio,"Aecs Layout Kundalahalli, Bangalore",Show Number,3.7,135,Yoga-Centres,JustDial,Bangalore,Aecs Layout Kundalahalli,Aecs Layout Kundalahalli
Harsha Yoga Pathashala,"3rd Main Road Nagarbhavi, Bangalore",Show Number,4.6,108,Yoga-Centres,JustDial,Bangalore,3rd Main Road Nagarbhavi,3rd Main Road Nagarbhavi
The Practice Room,"Bengaluru Cooke Town, Bangalore",Show Number,4.9,98,Yoga-Centres,JustDial,Bangalore,Bengaluru Cooke Town,Bengaluru Cooke Town
Swatma Yoga Centre,"Kachohalli Main Road ISRO Layout Kumaraswamy, Bangalore",Show Number,5.0,94,Yoga-Centres,JustDial,Bangalore,Kachohalli Main Road ISRO Layout Kumaraswamy,Kachohalli Main Road ISRO Layout Kumaraswamy
Best International Institute,"Chandra Layout Vijayanagar, Bangalore",Show Number,4.9,95,Yoga-Centres,JustDial,Bangalore,Chandra Layout Vijayanagar,Chandra Layout Vijayanagar
Swamy Vivekananda Yoga Kendra,"Dr Rajkumar Road Rajajinagar, Bangalore",Show Number,4.2,110,Yoga-Centres,JustDial,Bangalore,Dr Rajkumar Road Rajajinagar,Dr Rajkumar Road Rajajinagar
Zen Yoga Shala,"7th Cross Road Thanisandra, Bangalore",Show Number,4.9,94,Yoga-Centres,JustDial,Bangalore,7th Cross Road Thanisandra,7th Cross Road Thanisandra
CrossFit Agni,Bangalore 560043,9108850776.0,4.9,239,CrossFit-Box,JustDial,Bangalore 560043,Bangalore 560043,Bangalore 560043
I Think CrossFit,Bangalore 560037,9742568433.0,4.9,64,CrossFit-Box,JustDial,Bangalore 560037,Bangalore 560037,Bangalore 560037
CrossFit Yuva,Bangalore 560077,8277703706.0,4.8,77,CrossFit-Box,JustDial,Bangalore 560077,Bangalore 560077,Bangalore 560077
CrossFit For Sure,Bangalore 560077,9108456500.0,4.5,77,CrossFit-Box,JustDial,Bangalore 560077,Bangalore 560077,Bangalore 560077
Namma CrossFit HSR,"HSR Layout, Bangalore",8884562662.0,5.0,4,CrossFit-Box,JustDial,Bangalore,HSR Layout,HSR Layout
Once More CrossFit,Bangalore 560077,9449015091.0,4.7,34,CrossFit-Box,JustDial,Bangalore 560077,Bangalore 560077,Bangalore 560077
TFD CrossFit (Cult),"Koramangala, Bangalore",,4.6,514,CrossFit-Box,JustDial,Bangalore,Koramangala,Koramangala
