name,address,phone,rating,reviews,category,Medium,City,Full Street Address,Area / Locality
Go Activ International,"R V Road Cross Basavanagudi, Bangalore",9980235474,4.8,107,Gyms,JustDial,Bangalore,R V Road Cross Basavanagudi,R V Road Cross Basavanagudi
Emerge Private Fitness Studio,"24th Cross Jayanagar 6th Block, Bangalore",9606166994,4.8,1,Gyms,JustDial,Bangalore,24th Cross Jayanagar 6th Block,24th Cross Jayanagar 6th Block
4th Station Gym,"2nd Block Basaveshwara Nagar, Bangalore",6366558724,4.5,467,Gyms,JustDial,Bangalore,2nd Block Basaveshwara Nagar,2nd Block Basaveshwara Nagar
Emerge Premium Fitness Studio,"S Kariyappa Road Jayanagar 7th Block, Bangalore",9054821932,4.8,119,Gyms,JustDial,Bangalore,S Kariyappa Road Jayanagar 7th Block,S Kariyappa Road Jayanagar 7th Block
Iconic Fitness Koramangala,"Wipro Signal Koramangala 1st Block, Bangalore",8904249820,4.7,802,Gyms,JustDial,Bangalore,Wipro Signal Koramangala 1st Block,Wipro Signal Koramangala 1st Block
Fitness Race,"Dinnur Main Road Rt Nagar, Bangalore",8105032618,4.5,382,Gyms,JustDial,Bangalore,Dinnur Main Road Rt Nagar,Dinnur Main Road Rt Nagar
Witness The Fitness,"Devachikkahalli Main Road Begur, Bangalore",7041567319,4.9,395,Gyms,JustDial,Bangalore,Devachikkahalli Main Road Begur,Devachikkahalli Main Road Begur
Zero 3,"29th Cross Main Road Kaggadasapura Road, Bangalore",7048312669,5.0,1,Gyms,JustDial,Bangalore,29th Cross Main Road Kaggadasapura Road,29th Cross Main Road Kaggadasapura Road
Tenzee Multisports,"Bannerghatta Main Road Bilekahalli, Bangalore",9724613948,4.3,187,Gyms,JustDial,Bangalore,Bannerghatta Main Road Bilekahalli,Bannerghatta Main Road Bilekahalli
Jaguar Fitness Maruthi Nagar,"Maruthi Nagar Madiwala, Bangalore",8511066401,4.6,367,Gyms,JustDial,Bangalore,Maruthi Nagar Madiwala,Maruthi Nagar Madiwala
Kittys Muscle Planet,"Modi Hospital Road Basaveshwara Nagar, Bangalore",8460484369,4.9,367,Gyms,JustDial,Bangalore,Modi Hospital Road Basaveshwara Nagar,Modi Hospital Road Basaveshwara Nagar
Athletes Revolution Fitness Center,"Oil Mill Road Kammanahalli, Bangalore",8401150426,5.0,211,Gyms,JustDial,Bangalore,Oil Mill Road Kammanahalli,Oil Mill Road Kammanahalli
Clout Fit,"Whitefield Hoskote Road Belathur, Bangalore",8401264082,4.9,671,Gyms,JustDial,Bangalore,Whitefield Hoskote Road Belathur,Whitefield Hoskote Road Belathur
Emerge Private Fitness Studio - RR Nagar,"Rajarajeshwari Nagar, Bangalore",9606292814,4.9,565,Gyms,JustDial,Bangalore,Rajarajeshwari Nagar,Rajarajeshwari Nagar
Get Sculpt Here,"Ambedkar Nagar Hill Top Whitefield, Bangalore",7041151920,3.5,2,Gyms,JustDial,Bangalore,Ambedkar Nagar Hill Top Whitefield,Ambedkar Nagar Hill Top Whitefield
Emerge Fitness Studio and Sports Arena Kengeri,"Kengeri Ring Road Gnanabharathi, Bangalore",8123790528,4.5,14,Gyms,JustDial,Bangalore,Kengeri Ring Road Gnanabharathi,Kengeri Ring Road Gnanabharathi
Rowell Fitness,"1st Jp Nagar 7th Phase, Bangalore",9035018526,4.9,449,Gyms,JustDial,Bangalore,1st Jp Nagar 7th Phase,1st Jp Nagar 7th Phase
Gonature Fitness Centre,"4th Phase Yelahanka New Town, Bangalore",9035079230,4.5,285,Gyms,JustDial,Bangalore,4th Phase Yelahanka New Town,4th Phase Yelahanka New Town
Fit Society,"Bull Temple Main Road Basavanagudi, Bangalore",9845270206,4.9,214,Gyms,JustDial,Bangalore,Bull Temple Main Road Basavanagudi,Bull Temple Main Road Basavanagudi
Sunrise Fitness,"4th Cross Sudhama Nagar, Bangalore",9980209662,4.6,24,Gyms,JustDial,Bangalore,4th Cross Sudhama Nagar,4th Cross Sudhama Nagar
Clout Fit,"Kodigehalli Main Road Krishnarajapuram, Bangalore",8401768770,4.7,722,Gyms,JustDial,Bangalore,Kodigehalli Main Road Krishnarajapuram,Kodigehalli Main Road Krishnarajapuram
Skanda Fitness Centrer,"8th Cross Kaveri Kantha Koramangala, Bangalore",7411829469,4.8,542,Gyms,JustDial,Bangalore,8th Cross Kaveri Kantha Koramangala,8th Cross Kaveri Kantha Koramangala
Apple Fitness,"18th Main Road Jayanagar 4th T Block, Bangalore",8460415524,4.1,752,Gyms,JustDial,Bangalore,18th Main Road Jayanagar 4th T Block,18th Main Road Jayanagar 4th T Block
Silhouette Fitness,"24th Cross Road Banashankari 2nd Stage, Bangalore",9980229160,4.6,652,Gyms,JustDial,Bangalore,24th Cross Road Banashankari 2nd Stage,24th Cross Road Banashankari 2nd Stage
Finix Fitness Studio,"Gandhi Bazar Main Road Basavanagudi, Bangalore",8050765716,4.6,883,Gyms,JustDial,Bangalore,Gandhi Bazar Main Road Basavanagudi,Gandhi Bazar Main Road Basavanagudi
Vivs Gym,"Mosque Road Frazer Town, Bangalore",8050264059,4.3,262,Gyms,JustDial,Bangalore,Mosque Road Frazer Town,Mosque Road Frazer Town
Excel Dance and Fitness,"BTM 4th Stage Vijaya Bank Layout, Bangalore",8490888466,4.5,74,Gyms,JustDial,Bangalore,BTM 4th Stage Vijaya Bank Layout,BTM 4th Stage Vijaya Bank Layout
Bmf Station Body Mind Fit,"Muneshwara Block Banashankari 3rd Stage, Bangalore",8460510367,4.6,114,Gyms,JustDial,Bangalore,Muneshwara Block Banashankari 3rd Stage,Muneshwara Block Banashankari 3rd Stage
Shields Fitness Club,"Vani Vilas Road Basavanagudi, Bangalore",9980543710,4.7,569,Gyms,JustDial,Bangalore,Vani Vilas Road Basavanagudi,Vani Vilas Road Basavanagudi
Wow Fitness Gym At Isro Layout,"Stage 2 Isro Layout, Bangalore",7041554537,4.8,506,Gyms,JustDial,Bangalore,Stage 2 Isro Layout,Stage 2 Isro Layout
Elite Squad Gymnastics Academy (Chandapura),"Marsur Gate Marsur, Bangalore",07383740174,4.8,29,Fitness-Studio,JustDial,Bangalore,Marsur Gate Marsur,Marsur Gate Marsur
Iconic Fitness Koramangala,"Wipro Signal Koramangala 1st Block, Bangalore",08904249820,4.7,802,Fitness-Studio,JustDial,Bangalore,Wipro Signal Koramangala 1st Block,Wipro Signal Koramangala 1st Block
Vivs Gym,"Mosque Road Frazer Town, Bangalore",08050264059,4.3,262,Fitness-Studio,JustDial,Bangalore,Mosque Road Frazer Town,Mosque Road Frazer Town
Excel Dance and Fitness,"BTM 4th Stage Vijaya Bank Layout, Bangalore",08490888466,4.5,74,Fitness-Studio,JustDial,Bangalore,BTM 4th Stage Vijaya Bank Layout,BTM 4th Stage Vijaya Bank Layout
Shubha Sangeetha Mattu Nrutya Paata Shale,"Nagadevanahalli-gnanabharathi, Bangalore",09980149688,4.1,11,Fitness-Studio,JustDial,Bangalore,Nagadevanahalli-gnanabharathi,Nagadevanahalli-gnanabharathi
Skanda Fitness Centrer,"8th Cross Kaveri Kantha Koramangala, Bangalore",07411829469,4.8,542,Fitness-Studio,JustDial,Bangalore,8th Cross Kaveri Kantha Koramangala,8th Cross Kaveri Kantha Koramangala
Fit Society,"Bull Temple Main Road Basavanagudi, Bangalore",09845270206,4.9,214,Fitness-Studio,JustDial,Bangalore,Bull Temple Main Road Basavanagudi,Bull Temple Main Road Basavanagudi
Reckon Dance Zumba & Fitness Studio LLP,"Dr. Shivaramkaranth Nagar Mcehslayout Hegde Nagar, Bangalore",07490847214,4.7,101,Fitness-Studio,JustDial,Bangalore,Dr. Shivaramkaranth Nagar Mcehslayout Hegde Nagar,Dr. Shivaramkaranth Nagar Mcehslayout Hegde Nagar
Prafitz Dance & Fitness,"Immadihalli Main Road Whitefield, Bangalore",07487861570,4.9,49,Fitness-Studio,JustDial,Bangalore,Immadihalli Main Road Whitefield,Immadihalli Main Road Whitefield
Shields Fitness Club,"Vani Vilas Road Basavanagudi, Bangalore",09980543710,4.7,569,Fitness-Studio,JustDial,Bangalore,Vani Vilas Road Basavanagudi,Vani Vilas Road Basavanagudi
Silhouette Fitness,"24th Cross Road Banashankari 2nd Stage, Bangalore",09980229160,4.6,652,Fitness-Studio,JustDial,Bangalore,24th Cross Road Banashankari 2nd Stage,24th Cross Road Banashankari 2nd Stage
Rowell Fitness,"1st Jp Nagar 7th Phase, Bangalore",09035018526,4.9,449,Fitness-Studio,JustDial,Bangalore,1st Jp Nagar 7th Phase,1st Jp Nagar 7th Phase
Fitness Race,"Dinnur Main Road Rt Nagar, Bangalore",08105032618,4.5,382,Fitness-Studio,JustDial,Bangalore,Dinnur Main Road Rt Nagar,Dinnur Main Road Rt Nagar
Apple Fitness,"18th Main Road Jayanagar 4th T Block, Bangalore",08460415524,4.1,752,Fitness-Studio,JustDial,Bangalore,18th Main Road Jayanagar 4th T Block,18th Main Road Jayanagar 4th T Block
Emerge Fitness Studio and Sports Arena Kengeri,"Kengeri Ring Road Gnanabharathi, Bangalore",08123790528,4.5,14,Fitness-Studio,JustDial,Bangalore,Kengeri Ring Road Gnanabharathi,Kengeri Ring Road Gnanabharathi
Get Sculpt Here,"Ambedkar Nagar Hill Top Whitefield, Bangalore",07041151920,3.5,2,Fitness-Studio,JustDial,Bangalore,Ambedkar Nagar Hill Top Whitefield,Ambedkar Nagar Hill Top Whitefield
Shorin Ryu Karate Do Martial Arts Fitness Clubs,"Gandhi Circle Varthur Varthur, Bangalore",09980239396,4.6,11,Fitness-Studio,JustDial,Bangalore,Gandhi Circle Varthur Varthur,Gandhi Circle Varthur Varthur
Athletes Revolution Fitness Center,"Oil Mill Road Kammanahalli, Bangalore",08401150426,5.0,211,Fitness-Studio,JustDial,Bangalore,Oil Mill Road Kammanahalli,Oil Mill Road Kammanahalli
Tenzee Multisports,"Bannerghatta Main Road Bilekahalli, Bangalore",09724613948,4.3,187,Fitness-Studio,JustDial,Bangalore,Bannerghatta Main Road Bilekahalli,Bannerghatta Main Road Bilekahalli
Leon Maestro De Fitness,"Kammanahalli Main Road Kammanahalli, Bangalore",09980137198,4.5,469,Fitness-Studio,JustDial,Bangalore,Kammanahalli Main Road Kammanahalli,Kammanahalli Main Road Kammanahalli
The Happy Yoga Community,"23rd Cross Jayanagar 7th Block, Bangalore",09725979029,4.7,219,Fitness-Studio,JustDial,Bangalore,23rd Cross Jayanagar 7th Block,23rd Cross Jayanagar 7th Block
Bangalore Indoor Cricket Club,"Next to G T Residential Layout Laggere, Bangalore",09980216977,4.2,962,Fitness-Studio,JustDial,Bangalore,Next to G T Residential Layout Laggere,Next to G T Residential Layout Laggere
Emerge Private Fitness Studio,"24th Cross Jayanagar 6th Block, Bangalore",09606166994,4.8,1,Fitness-Studio,JustDial,Bangalore,24th Cross Jayanagar 6th Block,24th Cross Jayanagar 6th Block
Excel Dance And Fitness Academy,"5th Cross Road Koramangala 6th Block, Bangalore",09740248499,4.7,76,Fitness-Studio,JustDial,Bangalore,5th Cross Road Koramangala 6th Block,5th Cross Road Koramangala 6th Block
Finix Fitness Studio,"Gandhi Bazar Main Road Basavanagudi, Bangalore",08050765716,4.6,883,Fitness-Studio,JustDial,Bangalore,Gandhi Bazar Main Road Basavanagudi,Gandhi Bazar Main Road Basavanagudi
Muscle Craft Fitness Centre,"24th Main Jp Nagar 5th Phase, Bangalore",09980011967,4.3,174,Fitness-Studio,JustDial,Bangalore,24th Main Jp Nagar 5th Phase,24th Main Jp Nagar 5th Phase
Move N Groove Dance and Fitness Studio Sanjaynagar Branch,"Sanjay Nagar Main Road Sanjay Nagar, Bangalore",08460492997,3.5,2,Fitness-Studio,JustDial,Bangalore,Sanjay Nagar Main Road Sanjay Nagar,Sanjay Nagar Main Road Sanjay Nagar
Kittys Muscle Planet,"Modi Hospital Road Basaveshwara Nagar, Bangalore",08460484369,4.9,367,Fitness-Studio,JustDial,Bangalore,Modi Hospital Road Basaveshwara Nagar,Modi Hospital Road Basaveshwara Nagar
Zero 3,"29th Cross Main Road Kaggadasapura Road, Bangalore",07048312669,5.0,1,Fitness-Studio,JustDial,Bangalore,29th Cross Main Road Kaggadasapura Road,29th Cross Main Road Kaggadasapura Road
Muscle Pump Gym,"ITI Layout Kathriguppe, Bangalore",08867682568,4.6,82,Fitness-Studio,JustDial,Bangalore,ITI Layout Kathriguppe,ITI Layout Kathriguppe
Jaguar Fitness Maruthi Nagar,"Maruthi Nagar Madiwala, Bangalore",08511066401,4.6,367,Fitness-Studio,JustDial,Bangalore,Maruthi Nagar Madiwala,Maruthi Nagar Madiwala
Emerge Premium Fitness Studio,"S Kariyappa Road Jayanagar 7th Block, Bangalore",09054821932,4.8,119,Fitness-Studio,JustDial,Bangalore,S Kariyappa Road Jayanagar 7th Block,S Kariyappa Road Jayanagar 7th Block
4th Station Gym,"2nd Block Basaveshwara Nagar, Bangalore",06366558724,4.5,467,Fitness-Studio,JustDial,Bangalore,2nd Block Basaveshwara Nagar,2nd Block Basaveshwara Nagar
Clout Fit,"Whitefield Hoskote Road Belathur, Bangalore",08401264082,4.9,671,Fitness-Studio,JustDial,Bangalore,Whitefield Hoskote Road Belathur,Whitefield Hoskote Road Belathur
Eden Spalicious Pvt Ltd,"Anjaneya Nagar Banashankari 3rd Stage, Bangalore",09980216892,3.6,121,Fitness-Studio,JustDial,Bangalore,Anjaneya Nagar Banashankari 3rd Stage,Anjaneya Nagar Banashankari 3rd Stage
Furyinc.Co,Bangalore,09980116072,4.4,4,Fitness-Studio,JustDial,Bangalore,Bangalore,Bangalore
Witness The Fitness,"Devachikkahalli Main Road Begur, Bangalore",07041567319,4.9,395,Fitness-Studio,JustDial,Bangalore,Devachikkahalli Main Road Begur,Devachikkahalli Main Road Begur
Reboot Fitness and Dance Studio,"Ombr Layout-Banaswadi, Bangalore",09980229077,4.5,39,Fitness-Studio,JustDial,Bangalore,Ombr Layout-Banaswadi,Ombr Layout-Banaswadi
Bmf Station Body Mind Fit,"Muneshwara Block Banashankari 3rd Stage, Bangalore",08460510367,4.6,114,Fitness-Studio,JustDial,Bangalore,Muneshwara Block Banashankari 3rd Stage,Muneshwara Block Banashankari 3rd Stage
Clout Fit,"Kodigehalli Main Road Krishnarajapuram, Bangalore",08401768770,4.7,722,Fitness-Studio,JustDial,Bangalore,Kodigehalli Main Road Krishnarajapuram,Kodigehalli Main Road Krishnarajapuram
Rba Of Arts,"Beml Layout Rajarajeshwari Nagar, Bangalore",09980539404,4.5,65,Fitness-Studio,JustDial,Bangalore,Beml Layout Rajarajeshwari Nagar,Beml Layout Rajarajeshwari Nagar
TFT GYM,"Kumaraswamy Layout Kumaraswamy Layout 1st Stage, Bangalore",09980232674,4.7,366,Fitness-Studio,JustDial,Bangalore,Kumaraswamy Layout Kumaraswamy Layout 1st Stage,Kumaraswamy Layout Kumaraswamy Layout 1st Stage
Sunrisers Sports & Cultural Federation,"Anand Layout Vidyaranyapura, Bangalore",Show Number,4.6,11,Fitness-Studio,JustDial,Bangalore,Anand Layout Vidyaranyapura,Anand Layout Vidyaranyapura
Fitness First,"Whitefield Main Road Whitefield, Bangalore",08401527147,4.3,185,Fitness-Studio,JustDial,Bangalore,Whitefield Main Road Whitefield,Whitefield Main Road Whitefield
M3 Fitness Club,"Marathalli Outer Ring Road Marathahalli, Bangalore",Show Number,4.3,64,Fitness-Studio,JustDial,Bangalore,Marathalli Outer Ring Road Marathahalli,Marathalli Outer Ring Road Marathahalli
SAP Fitness,"Kempegowda Layout Outer Ring Road Laggere, Bangalore",09980796687,5.0,35,Fitness-Studio,JustDial,Bangalore,Kempegowda Layout Outer Ring Road Laggere,Kempegowda Layout Outer Ring Road Laggere
Skanda Fitness Center,"8th Cross Road Jakkasandra, Bangalore",07947313088,4.8,547,Fitness-Studio,JustDial,Bangalore,8th Cross Road Jakkasandra,8th Cross Road Jakkasandra
Ymia Club,"Assaye Road, Bangalore",09606170197,4.0,69,Fitness-Studio,JustDial,Bangalore,Assaye Road,Assaye Road
TRIURGE,"Jayanagar, Bangalore",Show Number,4.8,103,Fitness-Studio,JustDial,Bangalore,Jayanagar,Jayanagar
Jbs Football Ground,"Krishnappa Garden C V Raman Nagar, Bangalore",08045784912,4.2,797,Fitness-Studio,JustDial,Bangalore,Krishnappa Garden C V Raman Nagar,Krishnappa Garden C V Raman Nagar
Body Edit,"80 Feet Road Padmanabhanagar, Bangalore",Show Number,5.0,194,Fitness-Studio,JustDial,Bangalore,80 Feet Road Padmanabhanagar,80 Feet Road Padmanabhanagar
Jayanagar Volleyball Stadium,"Bengaluru Jayanagar, Bangalore",09606185598,4.8,319,Fitness-Studio,JustDial,Bangalore,Bengaluru Jayanagar,Bengaluru Jayanagar
The Hsr Club,"22nd Cross HSR Layout Sector 3, Bangalore",Show Number,4.2,7,Fitness-Studio,JustDial,Bangalore,22nd Cross HSR Layout Sector 3,22nd Cross HSR Layout Sector 3
The Majesstine Sports,"5th Cross Garvebhavipalya, Bangalore",Show Number,4.4,3,Fitness-Studio,JustDial,Bangalore,5th Cross Garvebhavipalya,5th Cross Garvebhavipalya
Star Fitness Gym & Health Club,"Saraswathipuram Main Road Saraswathipuram, Bangalore",Show Number,4.0,3,Fitness-Studio,JustDial,Bangalore,Saraswathipuram Main Road Saraswathipuram,Saraswathipuram Main Road Saraswathipuram
Hawk Fitness,"Electronic C electronic city, Bangalore",Show Number,4.9,1,Fitness-Studio,JustDial,Bangalore,Electronic C electronic city,Electronic C electronic city
Moveza Fitness - Panathur,"Panathur Road Kadubeesanahalli, Bangalore",Show Number,4.1,2,Fitness-Studio,JustDial,Bangalore,Panathur Road Kadubeesanahalli,Panathur Road Kadubeesanahalli
Zest Fitness Studio Ect,"Neeladri Road Electronic City, Bangalore",Show Number,4.8,1,Fitness-Studio,JustDial,Bangalore,Neeladri Road Electronic City,Neeladri Road Electronic City
Reforma Fitness Center,"Mathikere Main Road Mathikere, Bangalore",Show Number,4.8,1,Fitness-Studio,JustDial,Bangalore,Mathikere Main Road Mathikere,Mathikere Main Road Mathikere
Fitness Empire,"Outer Ring Road Marathahalli, Bangalore",Show Number,4.7,1,Fitness-Studio,JustDial,Bangalore,Outer Ring Road Marathahalli,Outer Ring Road Marathahalli
Fitness Fuel Factory,"17th Cross HSR Layout, Bangalore",Show Number,4.8,1,Fitness-Studio,JustDial,Bangalore,17th Cross HSR Layout,17th Cross HSR Layout
Srx Fitness Studio,"HMT Main Road Mathikere, Bangalore",Show Number,4.8,1,Fitness-Studio,JustDial,Bangalore,HMT Main Road Mathikere,HMT Main Road Mathikere
Zest Fitness Studio,"27th Main Road HSR Layout Sector 1, Bangalore",Show Number,4.6,1,Fitness-Studio,JustDial,Bangalore,27th Main Road HSR Layout Sector 1,27th Main Road HSR Layout Sector 1
Gold's Gym,"Whitefield Main Road Whitefield, Bangalore",Show Number,4.1,1,Fitness-Studio,JustDial,Bangalore,Whitefield Main Road Whitefield,Whitefield Main Road Whitefield
Bon Ton Fitness,"108 3RD FLOOR 4TH Nagasandra, Bangalore",Show Number,4.9,1,Fitness-Studio,JustDial,Bangalore,108 3RD FLOOR 4TH Nagasandra,108 3RD FLOOR 4TH Nagasandra
Muscle Planet,"Laggere Main Road Laggere, Bangalore",Show Number,4.9,1,Fitness-Studio,JustDial,Bangalore,Laggere Main Road Laggere,Laggere Main Road Laggere
Vinnis Fitness,"Hesarghatta Main Road Hessargatta Main Road, Bangalore",Show Number,4.9,1,Fitness-Studio,JustDial,Bangalore,Hesarghatta Main Road Hessargatta Main Road,Hesarghatta Main Road Hessargatta Main Road
Curl Fit,"Ejipura Main Road Ejipura, Bangalore",Show Number,4.8,1,Fitness-Studio,JustDial,Bangalore,Ejipura Main Road Ejipura,Ejipura Main Road Ejipura
Befiter Fitness,"11th Main Road Mathikere, Bangalore",Show Number,4.8,1,Fitness-Studio,JustDial,Bangalore,11th Main Road Mathikere,11th Main Road Mathikere
Arch Physiotherapy And Rehabilitation,"Kundanahalli Kundalahalli, Bangalore",Show Number,4.8,1,Fitness-Studio,JustDial,Bangalore,Kundanahalli Kundalahalli,Kundanahalli Kundalahalli
Stayfit Hub,"Bannerghatta Road Bannerghatta Road, Bangalore",Show Number,4.9,1,Fitness-Studio,JustDial,Bangalore,Bannerghatta Road Bannerghatta Road,Bannerghatta Road Bannerghatta Road
Athletes Revolution Fitness Center,"Oil Mill Road Kammanahalli, Bangalore",08401150426,5.0,211,Calisthenic-Gym,JustDial,Bangalore,Oil Mill Road Kammanahalli,Oil Mill Road Kammanahalli
Emerge Premium Fitness Studio,"S Kariyappa Road Jayanagar 7th Block, Bangalore",09054821932,4.8,119,Calisthenic-Gym,JustDial,Bangalore,S Kariyappa Road Jayanagar 7th Block,S Kariyappa Road Jayanagar 7th Block
Twistars Gymnastics,"Hrbr Layout, Bangalore",08460393915,4.9,120,Calisthenic-Gym,JustDial,Bangalore,Hrbr Layout,Hrbr Layout
Zest Fitness Studio Ect,"Neeladri Road Electronic City, Bangalore",Show Number,4.8,1,Calisthenic-Gym,JustDial,Bangalore,Neeladri Road Electronic City,Neeladri Road Electronic City
Zest Fitness Studio,"27th Main Road HSR Layout Sector 1, Bangalore",Show Number,4.6,1,Calisthenic-Gym,JustDial,Bangalore,27th Main Road HSR Layout Sector 1,27th Main Road HSR Layout Sector 1
Ramana Boxing Club,"Outer Ring Road Hrbr Layout, Bangalore",Show Number,4.4,620,Calisthenic-Gym,JustDial,Bangalore,Outer Ring Road Hrbr Layout,Outer Ring Road Hrbr Layout
Chaos Faktory,"15th Cross Road HSR Layout, Bangalore",Show Number,4.7,515,Calisthenic-Gym,JustDial,Bangalore,15th Cross Road HSR Layout,15th Cross Road HSR Layout
Fitness First (Eva Mall),"Brigade Road Brigade Road, Bangalore",Show Number,4.0,594,Calisthenic-Gym,JustDial,Bangalore,Brigade Road Brigade Road,Brigade Road Brigade Road
Health & Fitness Gym,"19 Khb Colony 5th Block Bengaluru Koramangala, Bangalore",Show Number,4.9,476,Calisthenic-Gym,JustDial,Bangalore,19 Khb Colony 5th Block Bengaluru Koramangala,19 Khb Colony 5th Block Bengaluru Koramangala
Fitness First,"100 Feet Inner Ring Road Koramangala, Bangalore",Show Number,3.9,584,Calisthenic-Gym,JustDial,Bangalore,100 Feet Inner Ring Road Koramangala,100 Feet Inner Ring Road Koramangala
Multifit Hrbr,"HRBR Layout Kalyan Nagar, Bangalore",Show Number,4.1,476,Calisthenic-Gym,JustDial,Bangalore,HRBR Layout Kalyan Nagar,HRBR Layout Kalyan Nagar
Multifit,"80 Feet Road HAL 2nd Stage Indiranagar, Bangalore",Show Number,4.1,329,Calisthenic-Gym,JustDial,Bangalore,80 Feet Road HAL 2nd Stage Indiranagar,80 Feet Road HAL 2nd Stage Indiranagar
Rise Fitness,"Hormavu Main Road Banaswadi, Bangalore",Show Number,4.9,264,Calisthenic-Gym,JustDial,Bangalore,Hormavu Main Road Banaswadi,Hormavu Main Road Banaswadi
Mani's Core Fit,"Malleswaram, Bangalore",Show Number,4.8,261,Calisthenic-Gym,JustDial,Bangalore,Malleswaram,Malleswaram
Fit Factory,"Uttarahalli Main Road Uttarahalli, Bangalore",Show Number,4.6,238,Calisthenic-Gym,JustDial,Bangalore,Uttarahalli Main Road Uttarahalli,Uttarahalli Main Road Uttarahalli
Maniac Lads Pvt Ltd,"Kagdaspura Main Road C V Raman Nagar, Bangalore",Show Number,4.9,205,Calisthenic-Gym,JustDial,Bangalore,Kagdaspura Main Road C V Raman Nagar,Kagdaspura Main Road C V Raman Nagar
Kineto Calisthenics Park,"Chikkalasandra Ramanjaneya Nagar, Bangalore",Show Number,5.0,200,Calisthenic-Gym,JustDial,Bangalore,Chikkalasandra Ramanjaneya Nagar,Chikkalasandra Ramanjaneya Nagar
Ace Fitness,"6th Block Banashankari 3rd Stage, Bangalore",Show Number,4.9,197,Calisthenic-Gym,JustDial,Bangalore,6th Block Banashankari 3rd Stage,6th Block Banashankari 3rd Stage
Fighter Club,"Begur Road, Bangalore",Show Number,5.0,190,Calisthenic-Gym,JustDial,Bangalore,Begur Road,Begur Road
Calibaf - The Calisthenics Studio,"7th Main Road Hrbr Layout, Bangalore",Show Number,4.9,191,Calisthenic-Gym,JustDial,Bangalore,7th Main Road Hrbr Layout,7th Main Road Hrbr Layout
Kranos Fitness Hub,"HSR Layout HSR Layout, Bangalore",Show Number,4.7,196,Calisthenic-Gym,JustDial,Bangalore,HSR Layout HSR Layout,HSR Layout HSR Layout
Karnos Fitness Hub,"Near It Park It Layout Sector 7 HSR Layout Sector 7, Bangalore",Show Number,4.7,194,Calisthenic-Gym,JustDial,Bangalore,Near It Park It Layout Sector 7 HSR Layout Sector 7,Near It Park It Layout Sector 7 HSR Layout Sector 7
The Movement Fitness Centre,"23rd Cross Road HSR Layout, Bangalore",Show Number,4.7,188,Calisthenic-Gym,JustDial,Bangalore,23rd Cross Road HSR Layout,23rd Cross Road HSR Layout
Bohofit Fitness Centre,"2nd Cross HSR Layout, Bangalore",Show Number,5.0,169,Calisthenic-Gym,JustDial,Bangalore,2nd Cross HSR Layout,2nd Cross HSR Layout
Nxtmove Fitness Pvt Ltd,"24th Main Road HSR Layout Sector 2, Bangalore",Show Number,4.7,143,Calisthenic-Gym,JustDial,Bangalore,24th Main Road HSR Layout Sector 2,24th Main Road HSR Layout Sector 2
Cult Fit,"Gangadhar Chetty Road Ulsoor, Bangalore",Show Number,4.1,162,Calisthenic-Gym,JustDial,Bangalore,Gangadhar Chetty Road Ulsoor,Gangadhar Chetty Road Ulsoor
Fusion Fitness,"5th Main Road Ittamadu, Bangalore",Show Number,4.8,132,Calisthenic-Gym,JustDial,Bangalore,5th Main Road Ittamadu,5th Main Road Ittamadu
Mind and Muscle Fitness,"Between Jp Nagar 7th Phase, Bangalore",Show Number,5.0,124,Calisthenic-Gym,JustDial,Bangalore,Between Jp Nagar 7th Phase,Between Jp Nagar 7th Phase
Republic Of Domination,"Panduranga Nagar, Bangalore",Show Number,4.9,108,Calisthenic-Gym,JustDial,Bangalore,Panduranga Nagar,Panduranga Nagar
Akhaada Crossfit Studio,"Anugraha Layout, Bangalore",Show Number,5.0,102,Calisthenic-Gym,JustDial,Bangalore,Anugraha Layout,Anugraha Layout
Fitness At Impact,"3rd Block Basaveshwara Nagar, Bangalore",,4.8,87,Calisthenic-Gym,JustDial,Bangalore,3rd Block Basaveshwara Nagar,3rd Block Basaveshwara Nagar
Bell Fitness and Play Arena,"Dodda Basti Main Road Sonnenahalli, Bangalore",Show Number,4.9,83,Calisthenic-Gym,JustDial,Bangalore,Dodda Basti Main Road Sonnenahalli,Dodda Basti Main Road Sonnenahalli
The Outfit Gym,"Sodepur Appareddipalya Bengaluru Indiranagar, Bangalore",Show Number,4.6,86,Calisthenic-Gym,JustDial,Bangalore,Sodepur Appareddipalya Bengaluru Indiranagar,Sodepur Appareddipalya Bengaluru Indiranagar
Muscle Garage,"Dr Rajkumar Road Rajajinagar 6th Block, Bangalore",Show Number,5.0,48,Calisthenic-Gym,JustDial,Bangalore,Dr Rajkumar Road Rajajinagar 6th Block,Dr Rajkumar Road Rajajinagar 6th Block
Get In Shape,"Seshadripuram, Bangalore",,4.9,8,Calisthenic-Gym,JustDial,Bangalore,Seshadripuram,Seshadripuram
Srushti Kala Mandira,"16th Jp Nagar 5th Phase, Bangalore",Show Number,4.3,8,Calisthenic-Gym,JustDial,Bangalore,16th Jp Nagar 5th Phase,16th Jp Nagar 5th Phase
Fitness Edge Equipments,"#44 CNR Complex Vinayaka Nagar Yelahanka, Bangalore",Show Number,3.8,5,Calisthenic-Gym,JustDial,Bangalore,#44 CNR Complex Vinayaka Nagar Yelahanka,#44 CNR Complex Vinayaka Nagar Yelahanka
The Cavalry Strength And Conditioning,"Street John'S Road St Johns Road, Bangalore",Show Number,4.4,4,Calisthenic-Gym,JustDial,Bangalore,Street John'S Road St Johns Road,Street John'S Road St Johns Road
Fit Equation Gym,"1st Phase Bharat Nagar, Bangalore",Show Number,5.0,2,Calisthenic-Gym,JustDial,Bangalore,1st Phase Bharat Nagar,1st Phase Bharat Nagar
Spartan Fitness,"Kogilu Main Road Kogilu, Bangalore",Show Number,4.0,2,Calisthenic-Gym,JustDial,Bangalore,Kogilu Main Road Kogilu,Kogilu Main Road Kogilu
Sri Gandha Gym,"Magadi Main Road Anjananagar, Bangalore",,5.0,1,Calisthenic-Gym,JustDial,Bangalore,Magadi Main Road Anjananagar,Magadi Main Road Anjananagar
Mr Chethan,"Mysore Road Kumbalgodu, Bangalore",Show Number,4.0,1,Calisthenic-Gym,JustDial,Bangalore,Mysore Road Kumbalgodu,Mysore Road Kumbalgodu
Mahi's Dance Club,"Ist Cross Road Bhagyalakshmi Avenue, Bangalore",Show Number,4.0,1,Calisthenic-Gym,JustDial,Bangalore,Ist Cross Road Bhagyalakshmi Avenue,Ist Cross Road Bhagyalakshmi Avenue
NB3 Fitness Centra gym,Bangalore,,3.0,1,Calisthenic-Gym,JustDial,Bangalore,Bangalore,Bangalore
