name,address,phone,rating,reviews,category
Befiter Fitness,"11th Main Road Mathikere, Bangalore",Show Number,4.8,1.0,Kickboxing-Studio
Fitness Honor,"Arakere, Bangalore",Show Number,4.9,1.0,Kickboxing-Studio
We Fitness Health And Wellness Centre,"23rd Main Jp Nagar 5th Phase, Bangalore",Show Number,4.4,1.0,Kickboxing-Studio
Cult Fit,"19th Main Road Hsr Layout Sector 1, Bangalore",Show Number,4.5,1.0,Kickboxing-Studio
Fitness Zone,"Marathahalli Sarjapur Road HSR Layout, Bangalore",Show Number,4.8,871.0,Kickboxing-Studio
Goldstar Fitness,"1st Main Road Venkateshwara Layout, Bangalore",Show Number,4.8,841.0,Kickboxing-Studio
Evolution Fitness,"14th Cross Kumaraswamy Layout 2 Stage, Bangalore",Show Number,4.7,815.0,Kickboxing-Studio
Reach Fitness,"Opposite BMTC Bus Stand Chandra Layout, Bangalore",Show Number,4.6,832.0,Kickboxing-Studio
Accolades Batminton and Sports Academy,"8th Mile Peenya Nagasandra, Bangalore",Show Number,4.2,892.0,Kickboxing-Studio
Turbo Fitness Studio,"Btm 6th Stage Hulimavu, Bangalore",Show Number,4.6,792.0,Kickboxing-Studio
Kia-kaha Mma Academy,"1st Cross Road Koramangala, Bangalore",Show Number,4.6,775.0,Kickboxing-Studio
I Fitness,"K H Road Shanthinagar, Bangalore",Show Number,4.3,796.0,Kickboxing-Studio
Beast Fitness Studio,"Rachenahalli Bengaluru Thanisandra, Bangalore",Show Number,4.9,678.0,Kickboxing-Studio
Den.2.fit,"80 Feet Road Koramangala, Bangalore",Show Number,4.8,689.0,Kickboxing-Studio
The Muscle Factory Unisex Gym,"60feet Road Brookefield, Bangalore",Show Number,4.6,717.0,Kickboxing-Studio
Fitness Tycoon,"22nd Cross Hsr Layout Sector 2, Bangalore",,4.5,709.0,Kickboxing-Studio
Fitrig Gym,"Manipalcounty Road Bommanahalli, Bangalore",Show Number,4.6,687.0,Kickboxing-Studio
Fitness Edge Sports Club,"Thindlu Main Road Vidyaranyapura, Bangalore",Show Number,4.9,643.0,Kickboxing-Studio
Fitness Honor Devarachikkanahalli,"2nd Cross Road Bannerghatta Road, Bangalore",Show Number,4.8,634.0,Kickboxing-Studio
Dumbbells Gym,"Electronic City, Bangalore",Show Number,4.6,622.0,Kickboxing-Studio
Shree Tejaswi Fitness Center,"9th Main Rajajinagar 2nd Stage, Bangalore",Show Number,4.8,581.0,Kickboxing-Studio
Satva Fitness,"Munnekollal Marathahalli, Bangalore",Show Number,3.9,702.0,Kickboxing-Studio
Ramana Boxing Club,"Outer Ring Road Hrbr Layout, Bangalore",Show Number,4.4,620.0,Kickboxing-Studio
Indian Fitness Fight Club,"Mg Layout Mullur, Bangalore",Show Number,4.9,555.0,Kickboxing-Studio
Fitness Edge,"Kodigehalli Police Station Kodigehalli, Bangalore",Show Number,4.9,554.0,Kickboxing-Studio
Absloute Fitness,"16th Main Rajajinagar 3rd Block, Bangalore",Show Number,4.9,554.0,Kickboxing-Studio
Poundd Fitness,"Old Airport Road Old Airport Road, Bangalore",Show Number,4.2,619.0,Kickboxing-Studio
Game On Fitness,"Marathahalli Sarjapur Road Kaikondrahalli, Bangalore",Show Number,4.8,535.0,Kickboxing-Studio
T99 Fitness,"HORAMAVU MAIN ROAD Horamavu, Bangalore",Show Number,4.5,547.0,Kickboxing-Studio
Bangalore Boxing Club,"Vyalikaval Hbcs Layout Nagawara, Bangalore",Show Number,4.6,521.0,Kickboxing-Studio
Gym Fitness Hub,"Hebbagodi, Bangalore",Show Number,4.8,493.0,Kickboxing-Studio
Crossfit,"Anekal Main Road Tavarekere Road, Bangalore",,4.8,486.0,Kickboxing-Studio
Health & Fitness Gym,"19 Khb Colony 5th Block Bengaluru Koramangala, Bangalore",Show Number,4.9,476.0,Kickboxing-Studio
Fitness First,"100 Feet Inner Ring Road Koramangala, Bangalore",Show Number,3.9,584.0,Kickboxing-Studio
Revive - The Elite Fitness Club,"Seegehalli Road Chaitanya Ananya, Bangalore",Show Number,4.9,458.0,Kickboxing-Studio
Jaguar Fitness Maruthi Nagar,"Maruthi Nagar Madiwala, Bangalore",08511066401,4.6,367.0,Pilates-Studio
Reboot Fitness and Dance Studio,"Ombr Layout-Banaswadi, Bangalore",09980229077,4.5,39.0,Pilates-Studio
Fitness Empire,"Outer Ring Road Marathahalli, Bangalore",Show Number,4.7,1.0,Pilates-Studio
Gold's Gym,"Whitefield Main Road Whitefield, Bangalore",Show Number,4.1,1.0,Pilates-Studio
Therige Bhavana,"Vinayaka Layout Nagarbhavi 2nd Stage, Bangalore",Show Number,4.0,1.0,Pilates-Studio
We Fitness Health And Wellness Centre,"23rd Main Jp Nagar 5th Phase, Bangalore",Show Number,4.4,1.0,Pilates-Studio
V K Sports,"Kaggadasapura Main Road Kagadasspura, Bangalore",Show Number,3.9,1.0,Pilates-Studio
Fit City Gym,"8th Cross Road C V Raman Nagar, Bangalore",Show Number,5.0,922.0,Pilates-Studio
Dynamic Fitness,"Bannerghatta Main Road BTM Layout 2nd Stage, Bangalore",Show Number,4.9,782.0,Pilates-Studio
Zela Luxury Health Clubs,"Residency Road Residency Road, Bangalore",Show Number,4.0,910.0,Pilates-Studio
Plej Fitness,"Green Glen Layout Bellandur, Bangalore",Show Number,4.0,884.0,Pilates-Studio
Dumbbells Gym,"Electronic City, Bangalore",Show Number,4.6,622.0,Pilates-Studio
Xna Fitness,"Yellanahalli, Bangalore",Show Number,4.7,608.0,Pilates-Studio
Poundd Fitness,"Old Airport Road Old Airport Road, Bangalore",Show Number,4.2,619.0,Pilates-Studio
Muscle Tech,"Guddahalli Thammenahalli Village, Bangalore",Show Number,4.8,520.0,Pilates-Studio
Fitness Ace,"Lakshmi Srinivasa Complex Rt Nagar, Bangalore",Show Number,4.3,569.0,Pilates-Studio
Apple Fitness,"5th A Cross Kalyan Nagar, Bangalore",Show Number,4.1,583.0,Pilates-Studio
Fitness First (Eva Mall),"Brigade Road Brigade Road, Bangalore",Show Number,4.0,594.0,Pilates-Studio
Transformers An Athletic Lab,"16th Main Road BTM Layout 2nd Stage, Bangalore",Show Number,4.6,512.0,Pilates-Studio
Fitness First,"100 Feet Inner Ring Road Koramangala, Bangalore",Show Number,3.9,584.0,Pilates-Studio
Addict Fitness,"80 Feet Road Kathriguppe, Bangalore",Show Number,4.9,448.0,Pilates-Studio
Stayfit Health & Fitness World Pvt Ltd,"30th Cross Jayanagar 4th Block, Bangalore",Show Number,4.4,462.0,Pilates-Studio
Rapid Sport Fitness,"Guava Garden KHB Road Koramangala 5th Block, Bangalore",Show Number,4.9,387.0,Pilates-Studio
Talwalkars Gym,"Bellary Road Sadashivanagar, Bangalore",Show Number,3.9,478.0,Pilates-Studio
Moveza Fitness,"1st Main Road Rajajinagar, Bangalore",Show Number,4.5,401.0,Pilates-Studio
Changeover Fitness Studio,"Govindaraj Nagar-Vijaynagar, Bangalore",Show Number,4.4,372.0,Pilates-Studio
Rhythmic Feet Fitness and Dance,"1st Main Koramangala 8th Block, Bangalore",Show Number,4.6,354.0,Pilates-Studio
Bodhi School Of Yoga,"Hoysala Nagar-Indiranagar, Bangalore",Show Number,4.9,322.0,Pilates-Studio
Siddhi Fitness Studio,"2nd Floor Jp Nagar 7th Phase, Bangalore",Show Number,5.0,308.0,Pilates-Studio
Fit Squad,"Banaswadi Main Road Banaswadi, Bangalore",Show Number,4.5,337.0,Pilates-Studio
Barbellhouse,"3rd Main Road Rajarajeshwari Nagar, Bangalore",Show Number,5.0,302.0,Pilates-Studio
Evolve Fitness Studio,"9th Crs Jayanagar 9th Block, Bangalore",Show Number,4.3,348.0,Pilates-Studio
Dhrutham Studio Of Dance,"Ramamurthy Nagar, Bangalore",Show Number,4.9,300.0,Pilates-Studio
Chisel Fitness,"80 Feet Road Vijayanagar, Bangalore",Show Number,4.4,316.0,Pilates-Studio
Studio Venus,"24th Main Jp Nagar, Bangalore",Show Number,4.5,299.0,Pilates-Studio
S 4 Fitness,"100 Feet Main Road Jayanagar 2nd Block, Bangalore",Show Number,4.1,317.0,Pilates-Studio
Mani's Core Fit,"Malleswaram, Bangalore",Show Number,4.8,261.0,Pilates-Studio
Feminine Gym,"Kammanahalli, Bangalore",Show Number,4.8,259.0,Pilates-Studio
Maxburn Fitness Studio & Gym,"6th Block Kormangala Koramangala 6th Block, Bangalore",Show Number,4.6,249.0,Pilates-Studio
Vriddhi Fitness And Wellness,"Bannerghatta Main Road Bannerghatta Road, Bangalore",Show Number,4.3,254.0,Pilates-Studio
GROUP EX FITNESS,"80Feet RT Nagar Main Road Rt Nagar, Bangalore",Show Number,4.6,237.0,Pilates-Studio
Step N Move Dance Academy,"Kothanur Post Office Road Kothanur, Bangalore",Show Number,4.8,226.0,Pilates-Studio
Cross Fit,"Jindal, Bangalore",Show Number,4.4,223.0,Pilates-Studio
Shadowz One Dance And Fitness Studio,"Amruthalli Main Road Jakkur Jakkur, Bangalore",Show Number,4.7,203.0,Pilates-Studio
Fiesta Zumba Fitness Studio,"Devarchikkanahalli Road Chikkanahalli Road, Bangalore",Show Number,4.5,203.0,Pilates-Studio
Tiger Gym,"Anjanapura, Bangalore",Show Number,4.9,180.0,Pilates-Studio
Republic Fitness,"Vasanthapura Main Road Vasanthpura, Bangalore",Show Number,4.7,169.0,Pilates-Studio
Beyond Fitness,"Ms Ramaiah Road Mathikere, Bangalore",Show Number,4.8,154.0,Pilates-Studio
Adapt Fitness,"Pottery Road Frazer Town, Bangalore",Show Number,4.5,163.0,Pilates-Studio
Group Fitness Studio,"Kalyan Nagar, Bangalore",Show Number,4.9,148.0,Pilates-Studio
R K Fitness Gym,"3rd Cross Umarbagh Layout, Bangalore",Show Number,4.6,156.0,Pilates-Studio
Cult Fit,"Konanakunte Main Road Konanakunte Cross, Bangalore",Show Number,3.6,196.0,Pilates-Studio
Pilates Circle By Cult,"Koramangala, Bangalore",Show Number,4.9,141.0,Pilates-Studio
My Beat Dance And Fitness Studio,"Manipal County Road Aecs B Block, Bangalore",Show Number,4.8,141.0,Pilates-Studio
I3 Fitness,"Nagarabhavi Ring Road Nagarbhavi 2nd Stage, Bangalore",Show Number,4.3,157.0,Pilates-Studio
Pilates for Wellbeing,"Kasturba Cross Road Lavelle Road, Bangalore",Show Number,4.6,146.0,Pilates-Studio
Highline Fitness 24x7,"R T Nagar Main Road Rt Nagar, Bangalore",Show Number,4.3,156.0,Pilates-Studio
Sparsh Yoga Centre,"24th Main Jp Nagar 6th Phase, Bangalore",Show Number,4.8,130.0,Pilates-Studio
Horse Fitness,"Basaveshwaranagar Main Road Basaveshwara Nagar, Bangalore",Show Number,4.6,133.0,Pilates-Studio
Synergy Multi Aerobics Studio,"Teachers Colony-Koramangala, Bangalore",Show Number,4.9,124.0,Pilates-Studio
Haadee Fitness Club,"9th Main Road Kalyan Nagar, Bangalore",Show Number,4.4,138.0,Pilates-Studio
Purple Pilates,"HSR Sector5/jakkasandra Koramangala 1st Block, Bangalore",Show Number,5.0,117.0,Pilates-Studio
KM3 Platinum Fitness,"Peenya 2nd Stage Hegganahalli Cross, Bangalore",Show Number,4.9,113.0,Pilates-Studio
SWEAT GROUP EX,"B Block Sahakara Nagar, Bangalore",Show Number,3.8,140.0,Pilates-Studio
Haadee Fitness Floor & Gym,"Hormavu Main Road Banaswadi, Bangalore",Show Number,4.6,112.0,Pilates-Studio
H2o Studioz,"Marathahalli Outer Ring Road Marathahalli, Bangalore",Show Number,5.0,98.0,Pilates-Studio
Breathe Wellness,"Puttenahalli Main Road Jp Nagar 7th Phase, Bangalore",Show Number,4.8,101.0,Pilates-Studio
Arivu School Of Yoga,"2nd Cross Dasarahalli Hebbal, Bangalore",Show Number,5.0,94.0,Pilates-Studio
Dr. Pilates Studio,"Horamavu Main Road Banaswadi, Bangalore",Show Number,4.9,89.0,Pilates-Studio
Palladium Dance Company,"17th Main Road Koramangala 5th Block, Bangalore",Show Number,4.7,91.0,Pilates-Studio
Yug Yoga,"14th Main Road Sahakara Nagar, Bangalore",Show Number,4.6,91.0,Pilates-Studio
Fille Fitness Only Ladies Gym,"Mosque Road Frazer Town, Bangalore",Show Number,4.2,96.0,Pilates-Studio
Coxbull Fitness,"9th Main Road Babusapalya, Bangalore",,4.8,81.0,Pilates-Studio
Tejas Studio,"Sarjapur Road Attibele, Bangalore",Show Number,4.9,77.0,Pilates-Studio
Pilates Hub,"27th Main Road Hsr Layout, Bangalore",Show Number,4.9,75.0,Pilates-Studio
Equinox Fitness Studio,"80 Feet Road Rt Nagar, Bangalore",Show Number,4.2,86.0,Pilates-Studio
Yog Gokul,"Off 80 Feet Road Koramangala 4th Block, Bangalore",Show Number,4.8,74.0,Pilates-Studio
Workout Hub,"4th Stage Basaveshwara Nagar, Bangalore",Show Number,4.3,80.0,Pilates-Studio
Swami Vivekananda Yoga Kuteera,"Sahayadri Layout Sidedahalli, Bangalore",Show Number,5.0,68.0,Pilates-Studio
Pilates Lab,"1st Main Road Byataranyanapura, Bangalore",Show Number,4.9,67.0,Pilates-Studio
Nature Essential S Pa and Salon,"Nagarbhavi, Bangalore",Show Number,4.6,68.0,Pilates-Studio
Leap Yoga & Fitness,"Robertson Road Frazer Town, Bangalore",Show Number,5.0,60.0,Pilates-Studio
Adhyatma Yoga,"26th Main Jayanagar 9th Block, Bangalore",Show Number,4.4,67.0,Pilates-Studio
Corepilates,"3rd Floor RMV Extension 2nd Stage, Bangalore",Show Number,4.7,60.0,Pilates-Studio
Sri Acharya Yoga,"Dollars Colony-RMV 2nd Stage, Bangalore",Show Number,4.9,54.0,Pilates-Studio
Mrudavae Yogashala,"Panathur Post Bellandur, Bangalore",Show Number,4.8,55.0,Pilates-Studio
The Piilates Studio,"Sair Bagh Cunningham Road, Bangalore",Show Number,4.0,65.0,Pilates-Studio
Reform Pilates Studio,"Hennur Bagalur Main Road Byrathi, Bangalore",Show Number,4.6,51.0,Pilates-Studio
Stance Active,"22nd Cross Roadclub Road Hsr Layout, Bangalore",Show Number,5.0,46.0,Pilates-Studio
Taekwondo Academy Of,"18th Cross Road Nagaraja Garden, Bangalore",,5.0,1.0,Taekwondo-Academy
Taekwondo International Academy,"6th Cross Road Kr Layout, Bangalore",,-,,Taekwondo-Academy
Vicktors Taekwondo Academy And Gym,"Bengaluru Kalkere Bengaluru Dodda Kempaiah Layout, Bangalore",,4.8,2.0,Taekwondo-Academy
Shankar Taekwondo Academy,"Muthyalamma Temple Road Doddaballapur, Bangalore",Show Number,4.5,18.0,Taekwondo-Academy
Sun Taekwondo Academy,"Vinayaka Layout-Nagarbhavi, Bangalore",Show Number,5.0,86.0,Taekwondo-Academy
Kwans Taekwondo Academy,"Hill View Residency Road Uttarahalli, Bangalore",Show Number,4.9,96.0,Taekwondo-Academy
Deccan Taekwondo Academy,"Rrmp Extension K H Road, Bangalore",Show Number,4.8,250.0,Taekwondo-Academy
Wings Taekwondo Academy,"Banaswadi, Bangalore",Show Number,4.9,39.0,Taekwondo-Academy
Skanda Taekwondo Academy,"#121 2nd Main Road Sahakara Nagar, Bangalore",Show Number,5.0,212.0,Taekwondo-Academy
CTA Taekwondo And Fitness Academy,"2nd Cross GNR Gardens Babusapalya, Bangalore",Show Number,5.0,152.0,Taekwondo-Academy
Asian Taekwondo Academy And Fitness Centre,"Rt Nagar 5th Main Road Rt Nagar, Bangalore",Show Number,4.9,47.0,Taekwondo-Academy
Sri Sai Taekwondo Academy,"6th Cross Road Kogilu, Bangalore",,5.0,22.0,Taekwondo-Academy
Taureaux Taekwondo Academy,"Hanumantha Nagar-Banashankari, Bangalore",Show Number,5.0,82.0,Taekwondo-Academy
Skanda Taekwondo Academy,"Byataranyanapura, Bangalore",,5.0,207.0,Taekwondo-Academy
Kims Taekwondo Academy,"7th Main Road Subbanapalaya, Bangalore",,4.7,18.0,Taekwondo-Academy
Jpl Taekwondo Academy,"Main Road Golahalli, Bangalore",Show Number,4.9,27.0,Taekwondo-Academy
M-Spirit Taekwondo Academy,"Rayasandra Main Road Naganathapura, Bangalore",Show Number,5.0,29.0,Taekwondo-Academy
Chanakyas Taekwondo And Fitness Academy,"Vidyaranyapura, Bangalore",Show Number,4.9,99.0,Taekwondo-Academy
Shree Taekwondo Academy,"1st Sector Hsr Layout, Bangalore",Show Number,4.2,30.0,Taekwondo-Academy
Taureaux Taekwondo Academy Btm,"BTM Layout 2nd Stage, Bangalore",Show Number,4.4,40.0,Taekwondo-Academy
Wrm Taekwondo Academy And Fitness Centre,"Victoria Layout Victoria Road, Bangalore",Show Number,4.6,31.0,Taekwondo-Academy
Manju Taekwondo Academy,"Thigala Chowdadenahalli Dommasandra, Bangalore",Show Number,4.9,6.0,Taekwondo-Academy
R W T F Taekwondo Academy,"Yelahanka, Bangalore",Show Number,3.5,9.0,Taekwondo-Academy
Ecseed Taekwondo Academy,"Agb Layout Chikkabanavara Bengaluru Chikbanavara, Bangalore",Show Number,4.8,22.0,Taekwondo-Academy
Cures Foundation And Chanakya's Taekwondo And Fitness Academy (R),"Sai Baba Temple Next Vidyaranyapura, Bangalore",Show Number,5.0,5.0,Taekwondo-Academy
S I Central Taekwondo Academy,"4th Cross Road Vijayanagar, Bangalore",Show Number,4.9,48.0,Taekwondo-Academy
S I Central Taekwondo Academy,"Opp.Hampinagar Bus Stand Rpc Layout, Bangalore",,4.9,30.0,Taekwondo-Academy
Phoenix Taekwondo Academy,"13th Cross Road Goripalya, Bangalore",,4.7,7.0,Taekwondo-Academy
Fighters Taekwondo Academy,"Muthyalamma Temple Complex Doddaballapura Doddaballapur, Bangalore",Show Number,4.9,20.0,Taekwondo-Academy
Global Mission Taekwondo Academy (Closed Down),"Nandanam Colony Banaswadi Main Road, Bangalore",,4.9,136.0,Taekwondo-Academy
Karnataka Sports And Taekwondo Academy,"2nd Stage Rajajinagar, Bangalore",Show Number,5.0,2.0,Taekwondo-Academy
Star Taekwondo Academy,"Netajinagar T Dasarahalli, Bangalore",Show Number,4.9,13.0,Taekwondo-Academy
Taureaux Taekwondo Academy JP Nagar (Closed Down),"Kothnur Main Road Jp Nagar 7th Phase, Bangalore",,5.0,8.0,Taekwondo-Academy
Aryans Taekwondo Academy,"Virgonagar, Bangalore",Show Number,5.0,15.0,Taekwondo-Academy
Nac Taekwondo Academy,"16th B Cross Road Yelahanka New Town, Bangalore",Show Number,5.0,14.0,Taekwondo-Academy
Hi Tech Taekwondo Academy,"17th G Main Road Rajajinagar 5th Block, Bangalore",Show Number,4.0,10.0,Taekwondo-Academy
Wrm Taekwondo Academy,"No.26 2nd Floor Akashya Commercial Complex Victoria Layout, Bangalore",Show Number,5.0,4.0,Taekwondo-Academy
Zenith Taekwondo Academy,"Spencer Road Pulikeshi Nagar, Bangalore",Show Number,4.0,3.0,Taekwondo-Academy
Karnataka Taekwondo Academy,"B D A Road Kanakapura Road, Bangalore",Show Number,-,,Taekwondo-Academy
Srv Taekwondo Academy,"Yelahanka New Town, Bangalore",,4.8,10.0,Taekwondo-Academy
V D S Dance Company & Lokesh Taekwondo Academy,"Taluk Office Road Doddaballapur, Bangalore",Show Number,-,,Taekwondo-Academy
Vital Momentum Fitness & Taekwondo Academy,"Sultanpalya Main Road Rt Nagar, Bangalore",Show Number,5.0,1.0,Taekwondo-Academy
Mauryan Taekwondo Academy,"17th Cross Road Agrahara Dasarahalli, Bangalore",Show Number,5.0,11.0,Taekwondo-Academy
Girinagar Taekwondo Academy,"2nd Phase Girinagar, Bangalore",Show Number,5.0,2.0,Taekwondo-Academy
Red Ant Taekwondo Academy,"1st Cross Road Ganga Nagar Extension, Bangalore",Show Number,4.6,8.0,Taekwondo-Academy
Karnataka Taekwondo Academy,"Rs Garden Bommasandra, Bangalore",,5.0,6.0,Taekwondo-Academy
Bheeshma Taekwondo Academy,"Thyagaraj Nagar, Bangalore",Show Number,4.5,4.0,Taekwondo-Academy
The Happy Yoga Community,"23rd Cross Jayanagar 7th Block, Bangalore",09725979029,4.7,219.0,Yoga-Centres
Dr. Latha Shekhars Holistic Wellness Centre,"VENKATESH MURTHY RD. Banashankari, Bangalore",09980134963,4.7,366.0,Yoga-Centres
Vishwa Poornima Yoga Centre,"2nd Stage Indiranagar, Bangalore",08128726662,4.8,552.0,Yoga-Centres
Ashish Yoga Fitness,"Brookfield Marathahalli, Bangalore",Show Number,4.9,1.0,Yoga-Centres
Yogamaya - Yoga 4 All,"19th Main Road Mc Layout, Bangalore",Show Number,4.9,1.0,Yoga-Centres
Gold's Gym,"Whitefield Main Road Whitefield, Bangalore",Show Number,4.1,1.0,Yoga-Centres
Swami Vivekananda Yoga Anusandhana Samsthana,"Giddenahalli Road Jigani, Bangalore",Show Number,4.3,1.0,Yoga-Centres
Art Of Living Yoga And Meditation,"2nd B Cross Girinagar, Bangalore",Show Number,4.9,889.0,Yoga-Centres
Sri Sri School Of Yoga,"21st Km Kanakapura Road, Bangalore",Show Number,5.0,811.0,Yoga-Centres
Paripurna Yoga Kendra,"10th A Cross Yelahanka New Town, Bangalore",Show Number,5.0,720.0,Yoga-Centres
Sai Power Yoga Institute,"Bannerghatta Road Akshayanagar, Bangalore",Show Number,5.0,587.0,Yoga-Centres
Sri Siddhalingeshwara Yoga Vana Hills,"Amruthur Road Yediyur, Bangalore",Show Number,3.6,791.0,Yoga-Centres
Sri Sai Powar Yoga Institute,"2nd Cross Road Devarachikkana Halli, Bangalore",Show Number,5.0,568.0,Yoga-Centres
Isha Hatha Yoga,"An Gupta Layout, Bangalore",Show Number,5.0,553.0,Yoga-Centres
God Gift Yoga and Nature Cure Centre,"Sultan Palya Main Road Rt Nagar, Bangalore",Show Number,4.7,556.0,Yoga-Centres
Be And Make Swami Vivekananda Yoga For Total Health And Peace,"10th Main Malleshpalya, Bangalore",Show Number,4.8,372.0,Yoga-Centres
Rashtrothana Yoga & Fitness Centre,"9th Cross Sadashivanagar, Bangalore",Show Number,4.8,370.0,Yoga-Centres
Yoga Paanchajanya Yoga,"Ranka Colony Road Bilekahalli, Bangalore",Show Number,4.9,350.0,Yoga-Centres
Akshar Yoga,"13th Cross Sadashivanagar, Bangalore",Show Number,4.1,414.0,Yoga-Centres
Sri Ramana Maharshi Foundation,"Anekal Taluk Attibele, Bangalore",Show Number,4.5,371.0,Yoga-Centres
Yoga Kulam,"CBI Road Rt Nagar, Bangalore",Show Number,4.9,335.0,Yoga-Centres
Aarogyadwar Holistic Center,"Basavanagar Main Road Basava Nagar, Bangalore",Show Number,5.0,321.0,Yoga-Centres
Bodhi Yoga Academy,"10th Main Road Jayanagar, Bangalore",Show Number,4.9,322.0,Yoga-Centres
Bodhi School Of Yoga,"Hoysala Nagar-Indiranagar, Bangalore",Show Number,4.9,322.0,Yoga-Centres
Vask Yoga Centre,"4th Main Road Hessargatta Main Road, Bangalore",Show Number,4.5,347.0,Yoga-Centres
Sri Raksha Yoga Kendra,"Balaji Street Ramamurthy Nagar, Bangalore",Show Number,4.9,313.0,Yoga-Centres
Vishwa Bhaavni Yoga Centre,"3rd Cross Road Circular Street, Bangalore",Show Number,4.8,302.0,Yoga-Centres
Sankalp Yoga Shala,"13th Cross Road Jayanagar 6th Block, Bangalore",Show Number,4.9,295.0,Yoga-Centres
Kushiyogalaya Yoga Classes,"Nandhini Layout. Nandini Layout, Bangalore",Show Number,5.0,284.0,Yoga-Centres
Sanskriti Yogashala,"Bangarappanagar Main Road Bangarappanagar, Bangalore",Show Number,4.9,288.0,Yoga-Centres
Bloom Prenatal Therapy Yoga,"KV Layout Jayanagar 4th T Block, Bangalore",,5.0,278.0,Yoga-Centres
Shoban's Creative Yoga,"Sharada Nagar-Bikasipura, Bangalore",Show Number,4.9,282.0,Yoga-Centres
Yoga Wellness Center,"2nd Cross Road Kasturi Nagar, Bangalore",Show Number,4.8,284.0,Yoga-Centres
Rashtrotthana Yoga Centre,"E Block Brookefield, Bangalore",Show Number,4.8,276.0,Yoga-Centres
A 1000 Yoga,"1st Cross Koramangala, Bangalore",Show Number,4.0,326.0,Yoga-Centres
Rv Yoga Kendra,"Ramamurthy Nagara Main Road Ramamurthy Nagar, Bangalore",Show Number,4.7,273.0,Yoga-Centres
Trimuk Yoga,"Jp Nagar 5th Phase, Bangalore",Show Number,4.9,250.0,Yoga-Centres
Chaitanya Wellness Yoga Academy,"GR Arcade Kasavanahalli, Bangalore",Show Number,4.8,248.0,Yoga-Centres
Sri Krishna Wellness Yoga And Cultural Centre,"6th Main Malleswaram, Bangalore",Show Number,4.7,250.0,Yoga-Centres
The Yoga Room By Vidhya Vakil,"National Games Village Complex KHB Games Village, Bangalore",Show Number,5.0,234.0,Yoga-Centres
Sunraya Yoga & Wellness Center,"NO 9 8TH E MAIN Vidyaranyapura, Bangalore",Show Number,4.9,236.0,Yoga-Centres
Stepperz Aerobics Dance N Yoga Studio,"13th Cross Sadashivanagar, Bangalore",Show Number,4.0,270.0,Yoga-Centres
Metta Yoga & Pilates Studio,"Ivri Road Yelahanka, Bangalore",Show Number,5.0,208.0,Yoga-Centres
Ashish Yoga Fitness Varthur,"Devasthanagalu, Bangalore",Show Number,5.0,202.0,Yoga-Centres
Aayana Yoga Academy,"37th Cross Jayanagar 4th T Block, Bangalore",Show Number,4.9,203.0,Yoga-Centres
Sri Gururaya School Of Yoga,"Gnana Bharathi Main Road Nagarbhavi, Bangalore",Show Number,4.9,202.0,Yoga-Centres
Chaitanya Wellness Yoga Studio,"7th Cross C V Raman Nagar, Bangalore",Show Number,4.6,209.0,Yoga-Centres
Deepam Yoga Classes,"Nagarabhavi Nagarbhavi, Bangalore",Show Number,4.9,188.0,Yoga-Centres
The Rising Soul Yoga,"Shirdi Sai Nagar-Munekollal, Bangalore",Show Number,4.9,186.0,Yoga-Centres
Chikitsa Yoga Treatment Center,"Uttarahalli Main Road Uttarahalli, Bangalore",Show Number,4.9,181.0,Yoga-Centres
National Academy For Naturopathy And Yoga,"3rd Cross Vijaya Bank Layout, Bangalore",Show Number,4.8,183.0,Yoga-Centres
Aarya Yoga,"10th Cross Road Hebbal, Bangalore",Show Number,4.9,178.0,Yoga-Centres
Prana Yoga Studio And Acupuncture Clinic,"K Narayanapura Road Kothanur, Bangalore",Show Number,4.7,180.0,Yoga-Centres
Shree Yoga Academy,"Double Road Doddakallasandra, Bangalore",Show Number,5.0,167.0,Yoga-Centres
Atma Darshan Yogashram,"Dayanandasagar College Road Kumaraswamy Layout, Bangalore",Show Number,4.6,176.0,Yoga-Centres
Shivananda Yoga Centtre,"9th B Cross HBR Layout 4th Block, Bangalore",Show Number,4.8,164.0,Yoga-Centres
Laksh Yoga,"Sarvabhouma Nagar Bilekahalli, Bangalore",Show Number,5.0,156.0,Yoga-Centres
Sangamithra Yoga,"Ramamurthy Nagar, Bangalore",Show Number,5.0,151.0,Yoga-Centres
Yogashree,"Ramakrishna Garden Girinagar, Bangalore",Show Number,4.9,153.0,Yoga-Centres
Vismaya Yoga Centre,"Begur Main Road Bommanahalli, Bangalore",Show Number,4.9,152.0,Yoga-Centres
Dharshmi Yoga Academy,"Outer Ring Road Mahadevapura, Bangalore",Show Number,4.8,155.0,Yoga-Centres
San Yoga Studio,"Tumkur Road Yeshwanthpur, Bangalore",Show Number,5.0,147.0,Yoga-Centres
Mamdev Yoga Hub,"Srinivasnagar Main Road Banashankari, Bangalore",Show Number,4.9,149.0,Yoga-Centres
Hriti Yoga By Ruchi,"Vigneshwar Nagar, Bangalore",Show Number,5.0,139.0,Yoga-Centres
Isha Yoga Center,"1st Block East Jayanagar 1st Block, Bangalore",Show Number,4.6,151.0,Yoga-Centres
Yogakshema Yoga Center,"10th Main Ngef Layout Nagarbhavi, Bangalore",Show Number,4.9,140.0,Yoga-Centres
Prashanth Yoga Mandir,"2nd Main Road Vijayanagar, Bangalore",,4.9,139.0,Yoga-Centres
Aayush Yoga Mandir And Fitness,"Srinivas Complex Doddaballapur, Bangalore",Show Number,4.9,138.0,Yoga-Centres
Fitness Yoga,"Wheeler Road Frazer Town, Bangalore",Show Number,4.8,133.0,Yoga-Centres
Nourish Homeyoga,"Krishnarajapuram, Bangalore",,4.9,130.0,Yoga-Centres
Sparsh Yoga Centre,"24th Main Jp Nagar 6th Phase, Bangalore",Show Number,4.8,130.0,Yoga-Centres
Vedic Yoga Shala,"1st Main Koramangala, Bangalore",Show Number,5.0,122.0,Yoga-Centres
Guhyamworld Health And Wellness Store,"5th A Main Road Malleshpalya, Bangalore",Show Number,5.0,119.0,Yoga-Centres
Do Yoga,"4th Main Road Hsr Layout, Bangalore",Show Number,4.6,127.0,Yoga-Centres
Shivanjali Yoga Kendra,"1st Cross Road Sahakara Nagar, Bangalore",Show Number,4.9,119.0,Yoga-Centres
Srimoyi Yoga,"Sarjapur Outer Ring Road Bellandur, Bangalore",Show Number,4.4,130.0,Yoga-Centres
Zorba - Yoga Studio,"Thambu Chetty Palya Main Road Ragavendra Circle, Bangalore",Show Number,4.7,116.0,Yoga-Centres
Kaushalam Yoga Kendra,"13th Cross Road Jp Nagar, Bangalore",Show Number,4.8,113.0,Yoga-Centres
Gnanisprit Yoga,"17th Main Road Byataranyanapura, Bangalore",Show Number,5.0,107.0,Yoga-Centres
Yoga Sangha,"19th Main Road Hsr Layout Sector 4, Bangalore",Show Number,4.8,111.0,Yoga-Centres
Akshar Power Yoga Academy,"Block C Sahakara Nagar, Bangalore",Show Number,4.4,119.0,Yoga-Centres
Shree Yoga,"Aecs Layout C Block Aecs Layout Bengaluru Brookefield, Bangalore",Show Number,4.9,105.0,Yoga-Centres
Neolife Yoga Studio,"Aecs Layout Kundalahalli, Bangalore",Show Number,3.7,135.0,Yoga-Centres
